{
  "world_id": "WLD-1f591576-f6c4-4c77-a975-08494320662d",
  "task_id": "TSK-90b6e64c-fe5c-429e-961f-a255d86643d9",
  "run_id": "RUN-438e830b-97d6-453c-ae5a-925c56af1a19",
  "agent_run_id": "ARN-a93720be-bd58-4dcf-be2f-dfca3beb5d65",
  "artifact_id": "ART-c43fca3e-d87f-45fe-ad62-428d8a5cea66",
  "canon_version": "CANON-191e98e943d3ff56d7479b8ff0e41e56b729a18a70a24555365a21f0aedb5168",
  "summary": "TEST FIXTURE: no model, research, or computation was run.",
  "claims": [
    {
      "claim_id": "CLM-a0ffbcd3-43bc-4b16-9009-bf9f3bbbd4d7",
      "category": "OPEN QUESTION",
      "statement": "TEST FIXTURE: this conceptual propulsion question has not been researched.",
      "evidence_ids": [],
      "entity_ids": [
        "TECH-001"
      ],
      "reasoning": "No research or computation was performed.",
      "assumptions": [],
      "uncertainty": "Synthetic example only; feasibility unknown.",
      "counterexamples": []
    }
  ],
  "assumptions": [],
  "open_questions": [
    "Await actual research."
  ],
  "metadata": {
    "test_fixture": true
  },
  "result_type": "historical",
  "causal_chains": [],
  "institutional_constraints": []
}
